{
  "task_id": "TASK-166",
  "date": "2026-03-28",
  "agent": "Codex",
  "status": "COMPLETE",
  "commit": "65ddf0b",
  "baseline_violations": 0,
  "post_task_violations": 0,
  "violations_delta": 0,
  "gates": [
    {"gate_id": "GATE1",  "triggered": true,  "status": "PASS",    "violations": []},
    {"gate_id": "GATE2",  "triggered": false, "status": "SKIPPED", "violations": []},
    {"gate_id": "GATE3",  "triggered": false, "status": "SKIPPED", "violations": []},
    {"gate_id": "GATE4",  "triggered": false, "status": "SKIPPED", "violations": []},
    {"gate_id": "GATE5",  "triggered": true,  "status": "PASS",    "violations": []},
    {"gate_id": "GATE6",  "triggered": true,  "status": "PASS",    "violations": []},
    {"gate_id": "GATEF1", "triggered": false, "status": "SKIPPED", "violations": []},
    {"gate_id": "GATEF2", "triggered": false, "status": "SKIPPED", "violations": []},
    {"gate_id": "GATEF3", "triggered": false, "status": "SKIPPED", "violations": []}
  ],
  "reviewer": {
    "verdict": "PASS",
    "acs": ["AC-1", "AC-2", "AC-3", "AC-4", "AC-5", "AC-6", "AC-7", "AC-8", "AC-9"],
    "assertion": {
      "ran": false,
      "expected": null,
      "actual": null,
      "match": null,
      "raw_output": "N/A — infra/tooling task, no Verification Matrix"
    },
    "scope_clean": true,
    "out_of_scope_files": [],
    "issues": []
  },
  "acs": [
    {"id": "AC-1", "status": "SATISFIED", "reason": "All 8 scripts accept --json as argparse store_true flag."},
    {"id": "AC-2", "status": "SATISFIED", "reason": "Each script emits single JSON object with gate, status, violations, violation_count when --json passed."},
    {"id": "AC-3", "status": "SATISFIED", "reason": "Violation objects normalised to file, line, rule, message across all scripts."},
    {"id": "AC-4", "status": "SATISFIED", "reason": "Prose output and exit codes unchanged when --json not passed."},
    {"id": "AC-5", "status": "SATISFIED", "reason": "Exit code 1 on FAIL, 0 on PASS in both modes."},
    {"id": "AC-6", "status": "SATISFIED", "reason": "Gate IDs match spec: GATE1..GATE6, GATEF1..GATEF3."},
    {"id": "AC-7", "status": "SATISFIED", "reason": "Smoke tests for GATE1 and GATE6 with --json produced PASS JSON, exit 0."},
    {"id": "AC-8", "status": "SATISFIED", "reason": "Only stdlib json added; no third-party dependencies."},
    {"id": "AC-9", "status": "SATISFIED", "reason": "GATE_SEQUENCE.md updated with --json note under every gate command block."}
  ],
  "files_modified": [
    "core/gen_ai/skills/validators/backend/boundary-sentinel/scripts/run_sentinel.py",
    "core/gen_ai/skills/guides/backend/duckdb-lint-ops/scripts/run_lint.py",
    "core/gen_ai/skills/validators/backend/manifest-contract-verifier/scripts/run_verifier.py",
    "core/gen_ai/skills/validators/backend/serialization-guard/scripts/run_lint.py",
    "core/gen_ai/skills/validators/frontend/frontend-lint-sentinel/scripts/run_frontend_lint.py",
    "core/gen_ai/skills/validators/frontend/frontend-paradigm-sentinel/scripts/run_frontend_paradigm.py",
    "core/gen_ai/skills/validators/frontend/frontend-type-sync-guard/scripts/run_type_sync.py",
    "core/utils/compliance_bouncer.py",
    "docs/guides/coreStandards/GATE_SEQUENCE.md",
    "agents/workflow/report-schema.json",
    "agents/skills/codex/commit-report.md",
    ".gitignore"
  ],
  "scope_violations": [],
  "blockers_hit": [],
  "taskfile_cleared": true
}
